{
  "schema_version": 1,
  "task_id": "atramenti-console-local-retirement-2026-05-11",
  "title": "Retire local Atramenti-Console checkout after capability ownership alignment",
  "agent_id": "codex",
  "status": "completed",
  "branch": "main",
  "conflict_policy": "coordinate-on-overlap",
  "claimed_paths": [
    "ecosystem/repos.json",
    "ecosystem/runtime-surfaces.json",
    "ecosystem/supply-relationships.json",
    "ecosystem/atramenti-capability-inventory.json",
    "docs/operations/atramenti-cleanstream-sync-plan.md",
    ".runtime/timeline/events.jsonl"
  ],
  "started_at": "2026-05-11T01:59:35Z",
  "updated_at": "2026-05-11T02:02:00Z",
  "handoff": null,
  "notes": "User requested Atramenti-Console cleanup, remote alignment, and local checkout deletion. This avoids README.md, project.json, and ecosystem/repository-consolidation.json, which are claimed by repository-consolidation-audit-2026-05-10."
}
